{
  "schema": "mind-detective-case/v1",
  "case_id": "legacy-1",
  "item_label": "ключи",
  "created_at": "2026-09-09T18:00:00Z",
  "updated_at": "2026-09-09T18:05:00Z",
  "lifecycle": "active",
  "statements": [],
  "timeline": null,
  "search_checks": [],
  "candidates": [],
  "next_action": null,
  "constraints": [],
  "outcome": null
}
